{
  "schema": "module_patrol_block.v1",
  "module_id": "feedback",
  "display_name": "反馈",
  "owner": "process_tree",
  "source_dir": "schemas",
  "process_tree_node_id": "feedback",
  "registration_status": "process_tree_status:implemented_skeleton",
  "gate": "system_patrol_coverage_gate",
  "compass": "system_patrol.feedback",
  "patrol_contract_version": "0.1.0",
  "lifecycle": "validated",
  "updated_at": "2026-07-01T11:39:08.902Z",
  "ttl_ms": 604800000,
  "change_session_id": "system_patrol_blocks_init_20260701",
  "data_flow": {
    "inputs": [
      "schemas/feedback-record.schema.json",
      "data/feedback/feedback-records.jsonl",
      "packages/storage-runtime/src/storage-runtime.mjs",
      "docs/10-第一阶段执行方案.md",
      "schemas/mvp-user-feedback.schema.json",
      "examples/mvp-user-feedback.sample.json",
      "packages/mvp-runtime/src/mvp-runtime.mjs"
    ],
    "processing": [
      "记录行动是否执行、是否回复、目标推进、关系变化、成本和用户评分。"
    ],
    "outputs": [
      "FeedbackRecord",
      "MvpUserFeedback",
      "user_test_review",
      "second_pass_optimization"
    ],
    "dependencies": [
      "examples/system-process-tree.json",
      "dialogue-system-patrol/registry/system-patrol-registry.json"
    ]
  },
  "state": {
    "headline": "反馈: patrol block initialized from process tree status implemented_skeleton.",
    "current_task": "Maintain summary-only patrol coverage and expose dialogue-readable state.",
    "progress": 1,
    "blockers": [],
    "risks": [
      "反馈字段需要在真实试点中继续压缩，避免用户不愿填写。",
      "反馈缺失时的默认处理策略还需要更多样例。",
      "用户专项测试反馈已可结构化进入闭环；后续需要用真实测试意见校准评分阈值和问题标记。"
    ],
    "next": [
      "Review this generated patrol block before treating it as a deep module interpretation.",
      "Refresh validation with npm.cmd run system-patrol:validate.",
      "Publish dialogue-readable output with npm.cmd run system-patrol:publish."
    ]
  },
  "evidence": {
    "source_refs": [
      "examples/system-process-tree.json",
      "schemas/feedback-record.schema.json",
      "data/feedback/feedback-records.jsonl",
      "packages/storage-runtime/src/storage-runtime.mjs",
      "docs/10-第一阶段执行方案.md",
      "schemas/mvp-user-feedback.schema.json",
      "examples/mvp-user-feedback.sample.json",
      "packages/mvp-runtime/src/mvp-runtime.mjs"
    ],
    "validation_commands": [
      "npm.cmd run system-patrol:validate",
      "npm.cmd run system-patrol:publish",
      "npm.cmd run process-tree:validate"
    ],
    "latest_validation_refs": [
      "runtime/dialogue-system-patrol-validations/latest.json"
    ]
  },
  "boundaries": {
    "mode": "controlled_write_runtime_summary",
    "allowed_reads": [
      "examples/system-process-tree.json",
      "schemas/feedback-record.schema.json",
      "data/feedback/feedback-records.jsonl",
      "packages/storage-runtime/src/storage-runtime.mjs",
      "docs/10-第一阶段执行方案.md",
      "schemas/mvp-user-feedback.schema.json",
      "examples/mvp-user-feedback.sample.json",
      "packages/mvp-runtime/src/mvp-runtime.mjs"
    ],
    "allowed_writes": [
      "runtime/status-cards/feedback.json",
      "runtime/status-events/feedback.json",
      "runtime/dialogue-system-patrol/**",
      "runtime/dialogue-system-patrol-validations/**"
    ],
    "forbidden_actions": [
      "no business module rewrite from patrol initialization",
      "no dialogue reader rewrite from patrol initialization",
      "no external platform action",
      "no raw private payload publication"
    ],
    "confirmation_gates": [
      "user confirmation required before protocol migration",
      "user confirmation required before process-tree and Obsidian registration"
    ]
  },
  "dialogue_limits": {
    "may_say": [
      "The module is represented in the process tree.",
      "The patrol block was initialized from process-tree summary evidence.",
      "Current status is summary-only and should cite source refs."
    ],
    "must_not_infer": [
      "Do not infer raw runtime facts that are not present in evidence refs.",
      "Do not treat generated patrol text as a full source-code review.",
      "Do not claim external actions or business outcomes from patrol coverage alone."
    ]
  },
  "versioning": {
    "supersedes": [],
    "source_hash": "sha256:89b927d904d817b3937c533ed5711565e5b58e98df226afcd70c95b4615020c7",
    "source_hash_algorithm": "patrol-source-v1:sha256",
    "source_hash_generated_at": "2026-07-05T13:12:46.780Z",
    "source_hash_refs": [
      "data/feedback/feedback-records.jsonl",
      "docs/10-第一阶段执行方案.md",
      "examples/mvp-user-feedback.sample.json",
      "examples/system-process-tree.json",
      "packages/mvp-runtime/src/mvp-runtime.mjs",
      "packages/storage-runtime/src/storage-runtime.mjs",
      "schemas/feedback-record.schema.json",
      "schemas/mvp-user-feedback.schema.json"
    ],
    "source_hash_excluded_refs": []
  }
}
