{
  "schema": "module_patrol_block.v1",
  "module_id": "user_goal",
  "display_name": "用户目标",
  "owner": "process_tree",
  "source_dir": "schemas",
  "process_tree_node_id": "user_goal",
  "registration_status": "process_tree_status:implemented_skeleton",
  "gate": "system_patrol_coverage_gate",
  "compass": "system_patrol.user_goal",
  "patrol_contract_version": "0.1.0",
  "lifecycle": "validated",
  "updated_at": "2026-07-01T11:39:08.902Z",
  "ttl_ms": 604800000,
  "change_session_id": "system_patrol_blocks_init_20260701",
  "data_flow": {
    "inputs": [
      "schemas/social-goal-input.schema.json",
      "docs/05-人类社交辅助系统集成方案.md",
      "docs/10-第一阶段执行方案.md"
    ],
    "processing": [
      "接收使用者初始目标、场景、对象、限制和偏好。"
    ],
    "outputs": [
      "SocialGoalInput"
    ],
    "dependencies": [
      "examples/system-process-tree.json",
      "dialogue-system-patrol/registry/system-patrol-registry.json"
    ]
  },
  "state": {
    "headline": "用户目标: patrol block initialized from process tree status implemented_skeleton.",
    "current_task": "Maintain summary-only patrol coverage and expose dialogue-readable state.",
    "progress": 1,
    "blockers": [],
    "risks": [
      "第一阶段真实目标样本还不足。",
      "用户偏好目前是基础配置，尚未由行为分析自动学习。"
    ],
    "next": [
      "Review this generated patrol block before treating it as a deep module interpretation.",
      "Refresh validation with npm.cmd run system-patrol:validate.",
      "Publish dialogue-readable output with npm.cmd run system-patrol:publish."
    ]
  },
  "evidence": {
    "source_refs": [
      "examples/system-process-tree.json",
      "schemas/social-goal-input.schema.json",
      "docs/05-人类社交辅助系统集成方案.md",
      "docs/10-第一阶段执行方案.md"
    ],
    "validation_commands": [
      "npm.cmd run system-patrol:validate",
      "npm.cmd run system-patrol:publish",
      "npm.cmd run process-tree:validate"
    ],
    "latest_validation_refs": [
      "runtime/dialogue-system-patrol-validations/latest.json"
    ]
  },
  "boundaries": {
    "mode": "controlled_write_runtime_summary",
    "allowed_reads": [
      "examples/system-process-tree.json",
      "schemas/social-goal-input.schema.json",
      "docs/05-人类社交辅助系统集成方案.md",
      "docs/10-第一阶段执行方案.md"
    ],
    "allowed_writes": [
      "runtime/status-cards/user_goal.json",
      "runtime/status-events/user_goal.json",
      "runtime/dialogue-system-patrol/**",
      "runtime/dialogue-system-patrol-validations/**"
    ],
    "forbidden_actions": [
      "no business module rewrite from patrol initialization",
      "no dialogue reader rewrite from patrol initialization",
      "no external platform action",
      "no raw private payload publication"
    ],
    "confirmation_gates": [
      "user confirmation required before protocol migration",
      "user confirmation required before process-tree and Obsidian registration"
    ]
  },
  "dialogue_limits": {
    "may_say": [
      "The module is represented in the process tree.",
      "The patrol block was initialized from process-tree summary evidence.",
      "Current status is summary-only and should cite source refs."
    ],
    "must_not_infer": [
      "Do not infer raw runtime facts that are not present in evidence refs.",
      "Do not treat generated patrol text as a full source-code review.",
      "Do not claim external actions or business outcomes from patrol coverage alone."
    ]
  },
  "versioning": {
    "supersedes": [],
    "source_hash": "sha256:cbf0d27cb1619a0974eec0c0f4342df775ab10419afdff9492f8008873795488",
    "source_hash_algorithm": "patrol-source-v1:sha256",
    "source_hash_generated_at": "2026-07-05T13:12:46.780Z",
    "source_hash_refs": [
      "docs/05-人类社交辅助系统集成方案.md",
      "docs/10-第一阶段执行方案.md",
      "examples/system-process-tree.json",
      "schemas/social-goal-input.schema.json"
    ],
    "source_hash_excluded_refs": []
  }
}
